{
  "schema_version": "cui-codex-case-v1",
  "case_id": "miniwob-click-test-r1",
  "objective": "Complete one MiniWoB click-test task without manual rescue.",
  "execution_mode": "exploratory_interaction",
  "benchmark": "miniwob",
  "task_id": "click-test",
  "environment_id": "browsergym/miniwob.click-test",
  "repetition": 1,
  "seed": 101,
  "limits": {
    "max_actions": 30,
    "timeout_seconds": 480
  },
  "actor": {
    "identity": "Codex Desktop",
    "surface": "app",
    "app_version": "observed-2026-08-11",
    "harness": "in_app_browser",
    "observed_at_utc": "2026-08-11T00:00:00Z",
    "backend_snapshot": null
  },
  "recorder": {
    "implementation": "browser_mv3",
    "version": "repository-build",
    "status": "captured",
    "session_id": "miniwob-click-test-r1-session",
    "record_sha256": "0000000000000000000000000000000000000000000000000000000000000000",
    "event_count": 6
  },
  "validator": {
    "implementation": "browsergym_official_reward",
    "reward": 1,
    "terminated": true,
    "truncated": false
  },
  "outcome": {
    "status": "success",
    "failure_code": null
  },
  "fresh_profile": true,
  "screenshots": [
    {
      "repository_path": "results/codex/miniwob-click-test-r1/final.png",
      "sha256": "0000000000000000000000000000000000000000000000000000000000000000",
      "caption": "Final MiniWoB state after the official reward was observed.",
      "cropped": false
    }
  ],
  "action_count": 3,
  "no_manual_rescue": true,
  "no_scripted_control": true,
  "started_at_utc": "2026-08-11T00:00:00Z",
  "completed_at_utc": "2026-08-11T00:01:00Z",
  "source_manifest": {
    "schema_version": "cui-source-manifest-v1",
    "manifest_id": "fixture-sources",
    "repository_path": "experiments/contracts/tests/fixtures/source_manifest.valid.json",
    "sha256": "0000000000000000000000000000000000000000000000000000000000000000"
  },
  "artifacts": [
    {
      "artifact_id": "fixture-report",
      "kind": "report",
      "repository_path": "reports/fixture.md",
      "sha256": "0000000000000000000000000000000000000000000000000000000000000000"
    }
  ],
  "verification": [
    {
      "check_id": "schema-validation",
      "status": "pass",
      "evidence_sha256": "0000000000000000000000000000000000000000000000000000000000000000"
    }
  ],
  "formal_claim_permitted": false,
  "human_participant_data_included": false,
  "secrets_included": false,
  "claim_boundary": "Exploratory engineering case only; no empirical or formal claim."
}
